<?xml version="1.0" encoding="UTF-8"?>
<interfaces 
	xmlns="http://www.w3school.com" 
	xmlns:xsi="http://www.w3.org/2001/XMLSchema-instance" 
	xsi:schemaLocation="http://www.w3school.com ../xsd/lenovo_sop.xsd">
	<!-- 别名映射，提供对别名和类全限定名之间的映射 -->
	<alias-mappings>
		<!-- domain取值inner和global,inner仅在接口内有效，global在全局有效,在不设置domain时默认为inner -->
		<mapping alias="OHJ190DTO" real="com.woate.talkingbird.dto.OHJ190DTO" domain="inner"/>
		<mapping alias="OHJ191DTO" real="com.woate.talkingbird.dto.OHJ191DTO" />
		<mapping alias="FHJ191DTO" real="com.woate.talkingbird.dto.FHJ191DTO"/>
		<mapping alias="ERR000DTO" real="com.woate.talkingbird.dto.ERR000DTO"  domain="global"/>
		<mapping alias="String" real="java.lang.String" domain="global"/>
		<mapping alias="string" real="java.lang.String" domain="global"/>
		<mapping alias="Date" real="java.util.Date" domain="global"/>
		<mapping alias="BigDecimal" real="java.math.BigDecimal" domain="global"/>
		<mapping alias="Integer" real="java.lang.Integer" domain="global"/>
		<mapping alias="int" real="java.lang.Integer" domain="global"/>
	</alias-mappings>
	<!-- 元信息池，提供对字段集中的定义 -->
	<metadatas-pool>
		<variable-field name="bankNo" encoding="UTF-8" desc="银行卡号" min-len="1" max-len="20" class="String" allow-null="false"/>
		<variable-field name="prodId" encoding="UTF-8" desc="合约代码" min-len="1" max-len="10" class="String" allow-null="true"/>
		<variable-field name="totalAmount" encoding="UTF-8" desc="总笔数" min-len="1" max-len="10" class="Integer" allow-null="false"/>
		<variable-field name="floatProfitAndLoss" encoding="UTF-8" desc="浮动盈亏" min-len="1" max-len="10" class="BigDecimal" allow-null="false"/>
	</metadatas-pool>
	<!-- 交易定义 name不一定是交易码，可能是组合交易的别名-->
	<interface name="HJ19">
		<!-- 请求节点 -->
		<request>
			<!-- 系统信息头 -->
			<sys inline="headers/sys.xml"/>
			<!-- 公共信息头 -->
			<com inline="headers/com.xml"/>
			<busis>
				<!-- 交易数据 name是交易码 -->
				<busi name="HJ19">
					<!-- 交易数据头 -->
					<header inline="headers/busi.xml"/>
					<object name="OHJ190" alias="OHJ190" type="bean" desc="HJ19请求对象" encoding="UTF-8" wrap-class="OHJ190DTO">
						<!-- 对元信息池的定义进行引用 -->
						<field ref="bankNo" alias="bankNo_REQ"/>
						<field ref="prodId" alias="prodId_REQ"/>
					</object>
				</busi>
			</busis>
		</request>
		<!-- 应答节点 -->
		<response>
			<!-- 系统信息头 -->
			<sys inline="headers/sys.xml"/>
			<!-- 公共信息头 -->
			<com inline="headers/com.xml"/>
			<busis>
				<!-- 交易数据 name是交易码 -->
				<busi name="HJ19">
					<!-- 交易数据头 -->
					<header inline="headers/busi.xml"/>
					<object name="OHJ191" alias="OHJ191" type="bean" desc="HJ19应答对象" encoding="UTF-8" wrap-class="OHJ191DTO">
						<field ref="totalAmount" alias="totalAmount_RSP" ></field>
					</object>
					<object name="FHJ191" alias="FHJ191" type="form" desc="HJ19应答表单" encoding="UTF-8" wrap-class="FHJ191DTO">
						<!-- 对元信息池的定义进行引用 -->
						<field ref="prodId" alias="prodId_RSP"/>
						<field ref="floatProfitAndLoss" alias="floatProfitAndLoss_RSP"/>
					</object>
				</busi>
			</busis>
		</response>
		<!--异常节点-->
		<exception>
			<!-- 系统信息头 -->
			<sys inline="headers/sys.xml"/>
			<!-- 公共信息头 -->
			<com inline="headers/com.xml"/>
			<busis>
				<!-- 交易数据 name是交易码 -->
				<busi name="HJ19">
					<!-- 交易数据头 -->
					<header inline="headers/busi.xml"/>
					<object name="ERR000" alias="ERR000" type="bean" desc="错误对象" encoding="UTF-8" wrap-class="ERR000DTO">
						<variable-field name="errorNo" alias="ERROR_NO" desc="错误序号" min-len="0" max-len="0" class="String" allow-null="true"/>
						<variable-field name="errorCode" alias="ERROR_CODE" desc="错误码" min-len="7" max-len="7" class="String" allow-null="true"/>
						<variable-field name="errorMsg" alias="ERROR_MESSAGE" desc="错误信息" min-len="1" max-len="200" class="String" allow-null="true"/>
					</object>
				</busi>
			</busis>
		</exception>
	</interface>
</interfaces>
